<?xml version="1.0" encoding="utf-8" ?>
<NEKTAR xmlns:xsi="http://www.w3.org/2001/XMLSchema-instance" xsi:noNamespaceSchemaLocation="http://www.nektar.info/nektar.xsd">
    <EXPANSIONS>
        <E COMPOSITE="C[0]" NUMMODES="8" FIELDS="u,v" TYPE="MODIFIED" />
        <E COMPOSITE="C[0]" NUMMODES="7" FIELDS="p" TYPE="MODIFIEDQUADPLUS1" />
    </EXPANSIONS>
    <CONDITIONS>
        <SOLVERINFO>
            <I PROPERTY="SolverType" VALUE="VelocityCorrectionScheme" />
            <I PROPERTY="EQTYPE" VALUE="UnsteadyNavierStokes" />
            <I PROPERTY="AdvectionForm" VALUE="Convective" />
            <I PROPERTY="Projection" VALUE="Galerkin" />
            <I PROPERTY="TimeIntegrationMethod" VALUE="IMEXOrder1" />
        </SOLVERINFO>
        <PARAMETERS>
            <P>TimeStep = 0.001</P>
            <P>NumSteps = 1000</P>
            <P>IO_CheckSteps = 1000</P>
            <P>IO_InfoSteps = 1000</P>
            <P>Kinvis = 1</P>
        </PARAMETERS>
        <VARIABLES>
            <V ID="0">u</V>
            <V ID="1">v</V>
            <V ID="2">p</V>
        </VARIABLES>
        <BOUNDARYREGIONS>
            <B ID="0">C[1]</B>
            <B ID="1">C[2]</B>
            <B ID="2">C[3]</B>
        </BOUNDARYREGIONS>
        <BOUNDARYCONDITIONS>
            <REGION REF="0">
                <D VAR="u" VALUE="0" />
                <D VAR="v" VALUE="0" />
                <N VAR="p" USERDEFINEDTYPE="H" VALUE="0" />
            </REGION>
            <REGION REF="1">
                <D VAR="u" VALUE="y*(1-y)" />
                <D VAR="v" VALUE="0" />
                <N VAR="p" USERDEFINEDTYPE="H" VALUE="0" />
            </REGION>
            <REGION REF="2">
                <N VAR="u" VALUE="0" />
                <N VAR="v" VALUE="0" />
                <D VAR="p" VALUE="0" />
            </REGION>
        </BOUNDARYCONDITIONS>
        <FUNCTION NAME="InitialConditions">
            <E VAR="u" VALUE="0" />
            <E VAR="v" VALUE="0" />
            <E VAR="p" VALUE="0" />
        </FUNCTION>
        <FUNCTION NAME="ExactSolution">
            <E VAR="u" VALUE="y*(1-y)" />
            <E VAR="v" VALUE="0" />
            <E VAR="p" VALUE="-2*Kinvis*(x-1)" />
        </FUNCTION>
    </CONDITIONS>
    <GEOMETRY DIM="2" SPACE="2" HDF5FILE="ChanFlow_m8.nekg" />
    <FILTERS>
        <FILTER TYPE="MaxMinFields">
            <PARAM NAME="OutputFrequency">2000</PARAM>
            <PARAM NAME="MaxOrMin">max</PARAM>
            <PARAM NAME="options">--error</PARAM>
        </FILTER>
    </FILTERS>
</NEKTAR>
